,CompanyName,Date,Title,level,overall_twitter_score,negative_score,positive_score,neutral_score,compound_score,final_tag,Close,final_tag_stock5,final_tag_bert
0,ASIAN PAINTS LTD,2020-10-05,"buy asian paints target price rs two thousand, one hundred and forty motilal oswal etmarkets dailyrecos stockpicks dailypicks asian paints home cor foray add sheen near-term volume growthimharshaj asian paints ltd consider q2 h1 fy21 results interim dividend oct twenty-two 2020asianpaints q2fy21 h1fy21 results interimdividend",3,0.29111963510513306,0.0,0.0,1.0,0.0,NEUTRAL,2028.0,NEGATIVE,POSITIVE
1,ASIAN PAINTS LTD,2020-10-06,market gains opening session hdfc asian paints indusind bank mahindra state bank india among gainers marketswithbs paint stocks focus asian paints berger paints hit record highs trending stock asian paints makes new 52-week high trending stock asian paints makes new 52-week high stock movers afternoon hdfc sobha tata motors thyrocare asian paints majesco,2,0.29218167066574097,0.0,0.044,0.956,0.34,POSITIVE,2090.0,POSITIVE,NEGATIVE
2,ASIAN PAINTS LTD,2020-10-07,"technical update top pick technical pick asian paints buy - tp two thousand, one hundred and eighty previous close two thousand and ninety sl two thousand and forty-five duration 2-3 daysclick know technical views index option trades marketsuprabhat technicalupdate momarketupdates technical update top pick technical pick asian paints buy - tp two thousand, one hundred and eighty previous close two thousand and ninety sl two thousand and forty-five duration 2-3 daysmarketsuprabhat technicalupdate momarketupdates technical update top picktechnical pick asian paints buy - tp two thousand, one hundred and eighty previous close two thousand and ninety sl two thousand and forty-five duration 2-3 days momarketupdates technicalupdate marketsuprabhat bswebexclusive berger paints asian paints record high technicals suggest upsideavdhutbagkar reportsmarketswithbs",5,0.3199969232082367,0.0,0.045,0.955,0.5267,POSITIVE,2105.0,POSITIVE,POSITIVE
3,ASIAN PAINTS LTD,2020-10-08,"technical update top picktechnical pick asian paints buy - tp two thousand, one hundred and eighty previous close two thousand, one hundred reco price two thousand and ninety sl two thousand and seventy duration 2-3 days technicalupdate marketsuprabhat sharekhanresearch consumer goods q2fy21 preview good recovery expected q2 rev growth cos stand 0-10 food cos 12-14 benign input prices help margin expansion most pref picks - hul nestle asian paints dabur godrej cons tata consumers",5,0.3199969232082367,0.0,0.151,0.849,0.8834,POSITIVE,2088.65,NEGATIVE,POSITIVE
4,ASIAN PAINTS LTD,2020-10-09,imp results next fortnight tues 13th wiprowed 14th- infythur 15th- mindtreefri 16th- hcl tech federal bank sat 17th- hdfc bankmon 19th acctues 20th- hulwed 21st bajaj fin bajaj finserv ultratechthur 22nd asian paints bajaj auto bioconfriday 23rd tech mah,5,0.2487480491399765,0.0,0.0,1.0,0.0,NEUTRAL,2050.6,NEGATIVE,POSITIVE
5,ASIAN PAINTS LTD,2020-10-12,consumer basket asian paints showing positive momentum relative strength says jc parets founder chief strategist  charts,3,0.2891947031021118,0.0,0.312,0.688,0.7783,POSITIVE,2077.85,POSITIVE,POSITIVE
6,ASIAN PAINTS LTD,2020-10-13,ultratech cement top gainer sensex pack rising around three per cent followed bharti airtel asian paints titan itc kotak bank lt,5,0.2740285396575928,0.0,0.083,0.917,0.2023,POSITIVE,2064.65,NEGATIVE,POSITIVE
7,ASIAN PAINTS LTD,2020-10-16,"opening bell markets resume move 1-day blip nifty opens eleven thousand, seven hundred mark gainers tata motors two indusind bank icici bank one losers upl -5 asian paints -1",3,0.2750897705554962,0.103,0.082,0.816,-0.1779,NEGATIVE,2061.2,NEGATIVE,POSITIVE
8,ASIAN PAINTS LTD,2020-10-20,attempting time high - asian paints,4,0.31870725750923157,0.0,0.0,1.0,0.0,NEUTRAL,2118.5,POSITIVE,POSITIVE
9,ASIAN PAINTS LTD,2020-10-21,strong market opening sensex three hundred and fifteen pointsnifty ninety points bank nifty leading front bank nifty three hundred and five points fresh fifty-two week highs paint companies like asian paints berger paints sensex nifty recover realty stocks shine berger paints acc asian paints touch fresh 52-week highs,4,0.3016796112060547,0.0,0.311,0.689,0.9477,POSITIVE,2114.3,NEGATIVE,POSITIVE
10,ASIAN PAINTS LTD,2020-10-22,"earningswithmc asian paints report sept quarter results today could see decline profitability check details asianpaints earnings asianpaintsq2 q2 top stocks focus asian paints bajaj auto bharti infratel dlfasianpaints stocktowatch vedanta nestle stocks watch nestle shares update ahead earnings tomorrow expect bajaj auto asian paints q2 discusses stocks dharmesh kant bqlive read stocks watch nestle shares update ahead earnings tomorrow expect bajaj auto asian paints q2alexandermats discusses stocks dharmesh kant bqstocks bqliveread top stocks bajaj auto asian paints hdfc amc lt finance holding ambuja cement vinniimotiwala stockstowatch relianceindustries sbicard asian paints bpcl kirloskar industries ultratech cement coal india stockstowatch asian paints bajaj auto biocon vedanta zeel kpit techheres list stocks may trade actively todays sessionmarketswithbs marketsnews important results today asian paints bajaj auto infratel bioconstockstowatch asianpaints infratel 2qwithcnbctv18 asian paints report q2 numbers today says good quarter expected 2qwithcnbctv18 asian paints report q2 numbers today says good quarter expected asian paints - double digit volume growth vs estimates 7-8 growth who covid covid covid earnings q2 solid beat asian paints - blows past estimates - revenue margin profitmargin two hundred and thirty-six vs estimates 212earnings stocks q2 q2withbq asian paints net profit rises one year-on-year catch live market updates q2withbq asian paints ebitda thirty-three year-on-year catch live market updates asian paints - super resultsmargin highest least thirty quartersvol growth double digit asian paints share trades lower ahead q2 earnings asian paints q2 operating profits forty-one rs1072cr asian paints saw demand rise india eased lockdown curbs lower costs aided margin second quarter q2withbq asian paints saw demand rise india eased lockdown curbs lower costs aided margin second quarter q2withbq marketatclose asian paints closes lows reporting highest margin least thirty qtrs asian paints ltd posts rs eighty-three thousand and thirty-seven crore consolidated pat q2fy21asianpaints q2fy21 h1fy21 resultupdate asian paints reports profit rs eight hundred and thirty crore september quarter asian paints ltd board approves interim dividend rs three hundred and thirty-five fy20-21asianpaints interimdividend fy2021 2qwithcnbctv18 asian paints q2fy21 earnings beat estimates frontsq2earnings q2results asian paints profit increased twenty-eight thousand, seven hundred and twenty-seven q2 fy 2020-21 asian paints announced dividend q2 two thousand and twenty asian paints q2 earnings beat estimates profit rises twelve double-digit volume growth decorative - asian paints revenue increased six previous year rs five thousand, three hundred and fifty crore quarter ended september q2withbq asian paintsasianpaints posts flat net profit rs eight hundred and fifty-two cr sept quarterfor details read bjps manifesto bihar elections promises free covid vaccine allasian paints reports double digit volume growth decorative business q2 resultsindia restores visas except electronic tourist medical categoriesshereenbhan headlines audiotweet durgapuja2020 asian paints ad mini pujo home melts million hearts watch viral dugga elo ghawrey videoasianpaints durgapuja asian paints - q2fy21 - angel brokingasianpaints q2fy21 asian paints - q2fy21 first cut - icici securitiesasianpaints q2fy21 firstcut icicisecurities etrealty asian paints net profit one hundred and fifteen rs eighty-five thousand, one hundred and ninety crore q2 fy21 asianpaints asianpaintsprofit paintsindustry amitsyngle asianpaintsresult asian paints q2 earnings beat street estimates net profit flat rs eight hundred and thirty crore",4,0.27463361620903015,0.024,0.155,0.821,0.9966,POSITIVE,2099.9,NEGATIVE,POSITIVE
11,ASIAN PAINTS LTD,2020-10-23,"2qwithcnbctv18 clsa raises revenue estimates asian paints 3-5 q2 results cnbctv18market 2qwithcnbctv18 citi say asian paints post q2 earnings cnbctv18market top stocks ambuja cements hdfc amc asian paints alembic pharma top stocks ambuja cements hdfc amc asian paints alembic pharma sharekhanresearch retains buy asian paints pt rs2475 vol growth eleven ahead street expectation 7-8 tier3-4 towns continues perform well metros recovered 70-80 benign input prices boost margins focus becoming complete home decor play clsa bullish asian paints bajaj auto ambuja cement september quarter earnings top brokerage calls today mcpro asian paints painting town red impressive earnings know great choice momentum tradersasianpaints earningswithmc asianpaintsq2 analysts raised target price asian paints demand improved lower costs aided margin q2here brokerages say q2withbq asian paints ltd - q2fy21 result update - yes securitiesasianpaints asian paints records q2 pat rs830cr demand improves across segment stock jumps 1asianpaints q2fy21 covid19 neutral asian paints target price rs one thousand, nine hundred and eighty motilal oswal etmarkets dailyrecos stockpicks dailypicks buy asian paints target price rs two thousand, four hundred and fifteen edelweiss etmarkets dailyrecos stockpicks dailypicks stocks track trade october twenty-three two thousand and twenty ambuja cements hdfc amc asian paints alembic pharma maintain reduce asian paints - standing tall - hdfc securitiesasianpaints revival consumer demand following gradual easing lockdown restrictions q2 aided top line asian paints q2withbq brokerages say asian paints q2 results q2withbq 2qwithcnbctv18 asian paints q2 numbers beat estimates brokerages sayasianpaints q2fy21 q2result q2earnings stock asian paints gained one per cent friday back good earnings september two thousand and twenty quarter company pace recovery better industry estimates explains impetus festive demand well says asian paints ceo q2withbq",5,0.26574522256851196,0.027,0.165,0.808,0.9903,POSITIVE,2120.25,POSITIVE,POSITIVE
12,ASIAN PAINTS LTD,2020-10-27,"share market news live sensex rises fifty points nifty eleven thousand, eight hundred and seven ntpc asian paints nestle top gainers share market news live sensex falls one hundred and fifty points nifty eleven thousand, seven hundred and twenty ntpc asian paints nestle top gainers share market news live sensex rises two hundred points nifty eleven thousand, eight hundred and thirty-five ntpc asian paints nestle top gainers add asian paints target price rs two thousand, three hundred icici securities etmarkets dailyrecos stockpicks dailypicks marketswithetnow acc gains since twenty-two april asian paints gains since seven april closing bell markets end higher one supported financial stocks nifty settles 11850-mark gainers kotakmahindrabank twelve nestle asian paints six losers hdfc tcs ongc -2 sensex ends three hundred and seventy-seven points higher nifty climbs eleven thousand, eight hundred and eighty-nine kotak mahindra bank bajaj finance nestle asian paints top gainers sensex nifty marketupdates kotak mahindra bank stock rallied twelve rs one thousand, five hundred and eighty-one tuesday ipca laboratories nestle muthoot finance asian paints bajaj finance among surge five",4,0.3016796112060547,0.017,0.198,0.785,0.9816,POSITIVE,2197.8,POSITIVE,POSITIVE
13,ASIAN PAINTS LTD,2020-10-28,"fo cues fiis unwind long positions index futures kotak mahindra bk asian paints see fresh longs brings derivatives cues watch trade today share market news live sensex one hundred and fifty points nifty eleven thousand, nine hundred and twenty kotak bank nestle asian paints top gainers",5,0.23247811198234558,0.0,0.176,0.824,0.7906,POSITIVE,2159.55,NEGATIVE,POSITIVE
14,ASIAN PAINTS LTD,2020-10-29,"past three months asian paints berger paints rallied twenty-eight nineteen respectively compared forty-six rise benchmark sensex marketswithbs stocksinnews marketsupdate closing bell sensex one hundred and fifty pts nifty eleven thousand, seven hundred mark gainers asian paints three tech mahindra two losers lt -4 titan -3 nifty",4,0.2397068440914154,0.064,0.147,0.789,0.5267,POSITIVE,2225.45,POSITIVE,POSITIVE
15,ASIAN PAINTS LTD,2020-11-02,important comment asian paintsrural india fastest growing currently,5,0.2487480491399765,0.0,0.368,0.632,0.3612,POSITIVE,2172.85,NEGATIVE,POSITIVE
16,ASIAN PAINTS LTD,2020-11-03,"share market news live sensex rises two hundred points nifty eleven thousand, seven hundred and thirty-five ntpc bpcl asian paints top gainres share market news live sensex rises three hundred and fifty points nifty eleven thousand, seven hundred and seventy ntpc bpcl asian paints top gainres",4,0.3016796112060547,0.0,0.251,0.749,0.886,POSITIVE,2154.65,NEGATIVE,POSITIVE
17,ASIAN PAINTS LTD,2020-11-05,asian paints limited - loss share certificates,4,0.31870725750923157,0.404,0.212,0.385,-0.25,NEGATIVE,2238.3,POSITIVE,POSITIVE
18,ASIAN PAINTS LTD,2020-11-06,"technical pick asian paints buy - tp two thousand, three hundred and fifty previous close two thousand, two hundred and thirty-four sl two thousand, one hundred and eighty-two duration 2-3 days technicalupdate marketsuprabhat momarketupdates asian paints pidilite ind trading strategies paint stocks post q2 nosavdhutbagkar writesmarketswithbs",5,0.3199969232082367,0.0,0.0,1.0,0.0,NEUTRAL,2209.05,NEGATIVE,POSITIVE
19,ASIAN PAINTS LTD,2020-11-09,"technical update top picktechnical pick asian paints buy - tp two thousand, three hundred and fifty previous close two thousand, two hundred and five sl two thousand, one hundred and eighty-two duration 2-3 days technicalupdate marketsuprabhat momarketupdates",5,0.3199969232082367,0.0,0.048,0.952,0.2023,POSITIVE,2225.2,POSITIVE,POSITIVE
20,ASIAN PAINTS LTD,2020-11-11,half-yearly profits national stock exchange nse dwarfed net incomes bluest d-street blue chips maruti suzuki hero motocorp even all-time favourite asian paints,5,0.25781577825546265,0.0,0.245,0.755,0.7579,POSITIVE,2181.7,NEGATIVE,POSITIVE
21,ASIAN PAINTS LTD,2020-11-18,watch amit syngle asian paints discuss organisations need use right technology improve productivity wfh tomorrow two hundred and thirty pm onwards live webinarlast chance register-forbesindiacxospeak workflowfromhome,5,0.39242592453956604,0.0,0.17,0.83,0.5994,POSITIVE,2195.75,POSITIVE,POSITIVE
22,ASIAN PAINTS LTD,2020-11-19,cnbctv18market clsa maintains outperform rating asian paints target rs 2285sh clsa bullish asian paints bharat forge jefferies jpmorgan bearish wipro,3,0.2891947031021118,0.0,0.0,1.0,0.0,NEUTRAL,2161.7,NEGATIVE,POSITIVE
23,ASIAN PAINTS LTD,2020-11-20,strong commentary asian paints management puts spotlight paint companies today asian paints says demand galloped aug september saw double digit volume growthdemand rally continued october festive season unprecedented demand t234 cities cnbctv18exclusive amit syngle md ceo asian paints says double-digit volume growth unprecedented times adds positivity market due good agrarian output post good monsoon bear spread strategy asian paints nandish shah hdfc securitiesmarkets bear spread strategy asian paints nandish shah hdfc securitiesmarkets,4,0.3016796112060547,0.035,0.212,0.753,0.9432,POSITIVE,2166.55,POSITIVE,POSITIVE
24,ASIAN PAINTS LTD,2020-11-23,"opening bell market opens higher sensex three hundred pts nifty twelve thousand, nine hundred mark gainers indusind bank four bajaj finserv three reliance two losers asian paints coal india stocks marginally nifty stocksinfocus",3,0.2750897705554962,0.088,0.133,0.779,0.1796,POSITIVE,2186.25,POSITIVE,POSITIVE
25,ASIAN PAINTS LTD,2020-11-27,sensex nifty open modest gains ntpc asian paints lead bqmarketsnow catch market updates opening bell sensex nifty trades flat midcaps outperform ntpc asian paints bajaj auto leadssensex nifty ntpc asianpaints bajajauto benchmark indices trading flat positive noteamong index heavyweight topmost gainers ntpc asian paints bajaj finance lt maruti ongc etc topmost loser powergrid airtel reliance itc tcs etcread more- marketupdate,4,0.3016796112060547,0.048,0.197,0.755,0.8658,POSITIVE,2215.3,POSITIVE,POSITIVE
26,ASIAN PAINTS LTD,2020-12-01,"technical update top picktechnical pick asian paints buy - tp two thousand, three hundred and fifteen previous close two thousand, two hundred and fifteen sl two thousand, one hundred and sixty-five duration 2-3 days technicalupdate marketsuprabhat momarketupdates",5,0.3199969232082367,0.0,0.048,0.952,0.2023,POSITIVE,2230.05,POSITIVE,POSITIVE
27,ASIAN PAINTS LTD,2020-12-02,"technical update top picktechnical pick asian paints buy - tp two thousand, three hundred and fifteen previous close two thousand, two hundred and thirty sl two thousand, one hundred and sixty-five duration 2-3 days technicalupdate marketsuprabhat momarketupdates closing bell sensex recovers 450-odd pts days low ends thirty-seven pts lower nifty thirteen thousand, one hundred ongc asian paints gain four marketatclose gail ongc asian paints coal india adani ports top nifty gainers",5,0.3199969232082367,0.053,0.154,0.793,0.7964,POSITIVE,2315.85,POSITIVE,POSITIVE
28,ASIAN PAINTS LTD,2020-12-04,momentumisers asian paints stock new high eighty-eight week tells us stock seeing strong momentum trade,2,0.29218167066574097,0.0,0.191,0.809,0.5106,POSITIVE,2438.75,POSITIVE,NEGATIVE
29,ASIAN PAINTS LTD,2020-12-07,sharekhanresearch retains buy asian paints revised tp rs2605 volume growth 8-12 sustain gradual recovery painting activities metros tier one towns tier thirty-four retains good demand gross margins remain high near term sharekhanfna,4,0.3016796112060547,0.121,0.144,0.735,0.2263,POSITIVE,2472.55,POSITIVE,POSITIVE
30,ASIAN PAINTS LTD,2020-12-08,oncnbctv18 randy watts oneil global advisors believes india 2nd best emerging market right nowon equities front watts likes pi industries asian paints tata cons among sectors watts liking tech healthcare india etnowexclusive caught asian paints amit syngle talk homeimprovement segment herere key highlights marketatclose reliance lift nifty asian paints bharti airtel sun pharma drag psu bank gains amongst indices reports privatisation,3,0.2750897705554962,0.026,0.206,0.767,0.9169,POSITIVE,2438.9,NEGATIVE,POSITIVE
31,ASIAN PAINTS LTD,2020-12-09,"seems everyone painting houses everydayasian paints ke saath closing bell market touched new highs sensex closed forty-six thousand, one hundred mark nifty settles thirteen thousand, five hundred levels gainers upl four asian paints ioc three losers hindalco shree cement -1nifty marketatclose thirty-three nifty stocks close higher upl asian paints ioc kotak bank top gainers hdfc bank kotak bank contribute eighty nifty bank gain today asian paints three hundred and thirty-seven pc rs 252115asianpaintskbsanandasianpaints",4,0.3016796112060547,0.041,0.159,0.8,0.836,POSITIVE,2522.3,POSITIVE,POSITIVE
32,ASIAN PAINTS LTD,2020-12-14,marine electricals bags order worth rs201cr firms like tata projects asian paints stock gains 15marineelectricals tataprojects asianpaints,2,0.29218167066574097,0.0,0.327,0.673,0.7003,POSITIVE,2548.15,POSITIVE,NEGATIVE
33,ASIAN PAINTS LTD,2020-12-15,cnbctv18market axis bank mm asian paints top nifty losers,3,0.2891947031021118,0.245,0.324,0.432,0.0258,POSITIVE,2527.45,NEGATIVE,POSITIVE
34,ASIAN PAINTS LTD,2020-12-17,"opening bell market opens flat sensex 46650-mark nifty thirteen thousand, six hundred and fifty levels gainers ongc shree cement one hindustan unilever nestle asian paints stocks marginally nifty stockmarket asian paints keep creating magic next decadei asked boss stocks investing wealthcreation stockmarket nifty50 business businessgrowth housing",3,0.2750897705554962,0.0,0.145,0.855,0.7436,POSITIVE,2575.05,POSITIVE,POSITIVE
35,ASIAN PAINTS LTD,2020-12-18,mcproopinion asian paints redrawing playbook environment mind ceo amit syngle underlines shifting contours interview asianpaints environment climatechange,2,0.29218167066574097,0.0,0.0,1.0,0.0,NEUTRAL,2601.5,POSITIVE,NEGATIVE
36,ASIAN PAINTS LTD,2020-12-21,"share market news live sensex drops two hundred points nifty thirteen thousand, six hundred and ninety asian paints sun pharma ntpc top losers",4,0.3016796112060547,0.117,0.23,0.653,0.3182,POSITIVE,2554.65,NEGATIVE,POSITIVE
37,ASIAN PAINTS LTD,2020-12-22,"share market news live sensex drops one hundred points nifty thirteen thousand, two hundred and eighty-five hul ntpc asian paints maruti top losers",4,0.3016796112060547,0.117,0.23,0.653,0.3182,POSITIVE,2600.8,POSITIVE,POSITIVE
38,ASIAN PAINTS LTD,2020-12-30,"share market news live sensex drops one hundred points nifty thirteen thousand, nine hundred and ten asian paints ntpc titan itc top losers",4,0.3016796112060547,0.117,0.23,0.653,0.3182,POSITIVE,2734.4,POSITIVE,POSITIVE
39,ASIAN PAINTS LTD,2021-01-06,"share market live news sensex nifty trade tad lower bajaj finserv asian paints hdfc twins top losers etrealty asian paints hasit dani buys rs 95-crore duplex carmichael road carmichaelroad mumbai asianpaints hindustanunilever hasitdani asian paints hasit dani buys rs 95-crore duplex carmichael road etindustrynews share market highlights sensex ends two hundred and sixty-three points lower nifty fourteen thousand, one hundred and forty-six ntpc asian paints mm top losers joining mumbai hasit dani family asian paints bought duplex apartment mumbai posh carmichael road rs ninety-five crorerealestate mumbai maharashtra housing hasitdani",4,0.3016796112060547,0.108,0.129,0.763,0.0516,POSITIVE,2805.35,POSITIVE,POSITIVE
40,ASIAN PAINTS LTD,2021-01-07,sharekhanresearch q3 preview fmcg universe rev grow eleven led improved vol growth opm sustain higher yoy due cost saving initiatives despite higher rm prices some preferred picks - hul asian paints itc dabur india tata consumer products emami,4,0.3016796112060547,0.0,0.137,0.863,0.6908,POSITIVE,2792.25,NEGATIVE,POSITIVE
41,ASIAN PAINTS LTD,2021-01-11,farmers immavu near mysuru protesting past fifty days front asian paints factory blocked several crucial entry gates shutting movement employees consignmentsxpressbengaluru,5,0.23247811198234558,0.205,0.0,0.795,-0.5994,NEGATIVE,2849.3,POSITIVE,POSITIVE
42,ASIAN PAINTS LTD,2021-01-12,cnbctv18market clsa shares view asian paints asian paintstypo,3,0.2891947031021118,0.0,0.239,0.761,0.296,POSITIVE,2720.55,NEGATIVE,POSITIVE
43,ASIAN PAINTS LTD,2021-01-14,equity benchmark sensex dropped one hundred and fifty points early trade thursday led heavy selling index-heavyweights infosys hcl tech asian paints sensex,4,0.27463361620903015,0.0,0.0,1.0,0.0,NEUTRAL,2663.9,NEGATIVE,POSITIVE
44,ASIAN PAINTS LTD,2021-01-18,share market news live sensex nifty trade tad higher sbi hcl tech asian paints itc ril top gainers,4,0.3016796112060547,0.0,0.309,0.691,0.6908,POSITIVE,2588.2,NEGATIVE,POSITIVE
45,ASIAN PAINTS LTD,2021-01-19,"buy asian paints target price rs two thousand, six hundred and sixty reliance securities etmarkets dailyrecos stockpicks dailypicks",3,0.29111963510513306,0.0,0.115,0.885,0.296,POSITIVE,2645.05,POSITIVE,POSITIVE
46,ASIAN PAINTS LTD,2021-01-20,rs 40300-crore indian decorative paints space dominated asian paints berger paints india kansai nerolac paints akzo nobel india collectively sixty-six market indigo paints completely focuses decorative paints segment asian paints account 95-97 revenue,5,0.25531286001205444,0.0,0.0,1.0,0.0,NEUTRAL,2697.25,POSITIVE,POSITIVE
