,CompanyName,Date,Title,level,overall_twitter_score,negative_score,positive_score,neutral_score,compound_score,final_tag,Close,final_tag_stock5,final_tag_bert
165,ASIAN PAINTS LTD,2021-11-03,"closing bell markets end lower ahead fomc meeting outcome tonight nifty settles seventeen thousand, eight hundred and fifty sensex drags two hundred and fifty pts gainers lt four asian paints hindalco two losers sun pharma indusind bank -3nifty sensex stockmarket stocks infra cement steel stocks support nifty lt grasim asian paints top gainersreal estate stocks continue move higher godrej prop oberoi 3-6escorts irctc union bank chambal fert bandhan bank top midcap losers",3,0.2891947031021118,0.125,0.137,0.738,0.0,NEUTRAL,3170.65,POSITIVE,POSITIVE
166,ASIAN PAINTS LTD,2021-11-09,oncnbctv18 improvement asset quality stands banks across board continue remain positive market leaders like asian paints says saurabh mukherjea oncnbctv18 improvement asset quality stands banks across board continue remain positive market leaders like asian paints says saurabh mukherjea asianpaint - announcement regulation thirty lodr-analyst investor meet - intimation asianpaint - disclosures reg three hundred and eleven three hundred and twelve sebi sast regulations2011 asianpaint - compliances-reg thirty-nine three - details loss certificate duplicate certificate,3,0.2750897705554962,0.025,0.256,0.718,0.9633,POSITIVE,3145.15,NEGATIVE,POSITIVE
167,ASIAN PAINTS LTD,2021-11-10,asianpaint - disclosures reg three hundred and eleven three hundred and twelve sebi sast regulations2011 berger paints much better asian paints ebitda forty-eight qoq6 yoy asian paints ebitda -1 qoq-29 yoy,4,0.31870725750923157,0.0,0.088,0.912,0.4404,POSITIVE,3108.3,NEGATIVE,POSITIVE
168,ASIAN PAINTS LTD,2021-11-12,tata steel top gainer sensex pack advancing two per cent followed sun pharma bajaj finserv infosys tech mahindra asian paints beatthestreet saurabh mukherjea says asian paints pidilite consolidating markets becoming master franchises watch nikunjdalmia marketswithetnow stockstowatch beatthestreet saurabh mukherjea says asian paints pidilite consolidating markets becoming master franchises check views asianpaints marketswithetnow stockstowatch asianpaint - disclosures reg three hundred and eleven three hundred and twelve sebi sast regulations2011 consumer-oriented companies like hindustan unilever asian paints britannia nestle witnessed heat rising prices quarterly results,5,0.3199969232082367,0.0,0.05,0.95,0.5106,POSITIVE,3122.9,POSITIVE,POSITIVE
169,ASIAN PAINTS LTD,2021-11-15,cnbctv18market ongc top nifty gainer despite reporting earnings lower expectations hero asian paints kotak bank amongst top gainers asian paints top gainer sensex pack advancing two per cent followed kotak mahindra bank hdfc bank axis bank indusind bank maruti suzuki,3,0.2891947031021118,0.0,0.286,0.714,0.8907,POSITIVE,3168.7,POSITIVE,POSITIVE
170,ASIAN PAINTS LTD,2021-11-16,cnbctv18market asian paints gains sharply lows reports company taking another price hike asian paints confirms taking 4-6 price hike dec 5alert asian paints earlier hiked prices 8-9 wef november 12alert asian paints cumulative price hike year 15-16asian paints post q2 earnings increase velocity price hike going ahead asian paints confirms price hike december 5alert asian paints earlier hiked prices 8-9 wef november 12alert asian paints cumulative price hike year 15-16asian paints post q2 earnings increase velocity price hike going ahead justin asian paints hiked prices 4-5 close heels record 7-10 increase companys dealers told moneycontrolread at by asianpaints business asianpaint - compliances-reg thirty-nine three - details loss certificate duplicate certificate,3,0.2891947031021118,0.035,0.079,0.886,0.6369,POSITIVE,3151.7,NEGATIVE,POSITIVE
171,ASIAN PAINTS LTD,2021-11-17,"cnbctv18market macquarie says price hike alleviate concern asian paints meeting 18-20 margin q4 cnbctv18market nomura maintains buy call asian paints expects margin pressure t abating faster expected marketswithmc opening bell indices open lower nifty seventeen thousand, nine hundred and fifty amid mixed global cues asian paints focusstockstowatch stockmarketindia stocks marketswithmc live closing bell markets end lower led oil gas stocks nifty drag seventeen thousand, nine hundred sensex slumps three hundred pts losers upl -3 reliance cipla -2 gainers sbi life twenty-five asian paints maruti 2niftybank stockmarket marketatclosesbi life top nifty gainer followed asian paints maruti tamo asianpaint - announcement regulation thirty lodr-analyst investor meet - intimation nse asian paint ewt money printing time -",3,0.2891947031021118,0.094,0.078,0.828,-0.25,NEGATIVE,3230.25,POSITIVE,POSITIVE
172,ASIAN PAINTS LTD,2021-11-18,asianpaint - compliances-reg thirty-nine three - details loss certificate duplicate certificate,4,0.31870725750923157,0.187,0.0,0.813,-0.3182,NEGATIVE,3226.85,NEGATIVE,POSITIVE
173,ASIAN PAINTS LTD,2021-11-22,cnbctv18market bharti airtel vodafone idea rise bharti announces tariff hike asian paints weak session ongc oil india pressure crude falls 6-week low marketatcloseongc oil india fall asian paints rise crude falling 6-week low,3,0.2891947031021118,0.413,0.0,0.587,-0.946,NEGATIVE,3261.25,POSITIVE,POSITIVE
174,ASIAN PAINTS LTD,2021-11-23,airtel parle-g asian paints airfares petrol vegetables medicines cooking oil,4,0.31870725750923157,0.0,0.0,1.0,0.0,NEUTRAL,3185.55,NEGATIVE,POSITIVE
175,ASIAN PAINTS LTD,2021-11-24,asian paints promoters come fire related party transactionsparagonworli18 reportasianpaint,4,0.31870725750923157,0.198,0.223,0.579,0.0772,POSITIVE,3157.0,NEGATIVE,POSITIVE
176,ASIAN PAINTS LTD,2021-11-25,"ingovern seeks resignation asian paints promoters lacking disclosures says ingoverns founder md shriram subramanian also says related party transactions disclosed adequately company asianpaint - news clarification asian paints replies ingovern report says paladin formed seven value goods bought promoter-led cos factually incorrect total five thousand, five hundred and thirty-nine cr purchase related parties purchase paladin rs thirteen cr less two total purchases related parties marketswithmc shares asian paints remained pressure news reports said proxy advisory firm ingovern pointed several related party transactions promotersreadasianpaints stocks stockmarket stockstowatch stocksinnews asian paints clarifies ingovern report says contains certain factually incorrect informationasianpaints asianpaints stockmarkets reliance industries asian paints itc latent view more key stocks moved nov twenty-five would respond ingoverns allegation clarify incorrect information says asian paints amazon asian paints tata tea emerged india purposeful brands technology non-fmcg fmcg categories respectively two thousand and twenty-one edition kantar annual brandz india report",5,0.2487480491399765,0.027,0.146,0.827,0.9465,POSITIVE,3144.25,NEGATIVE,POSITIVE
177,ASIAN PAINTS LTD,2021-11-26,asianpaint - announcement regulation thirty lodr-analyst investor meet - intimation building canvas trespassers kerala-based artists collective invited work ukkadam art district public art initiative t india foundation association asian paints coimbatore city corporation amazon asian paints tata tea emerge powerful purpose brands india,4,0.31870725750923157,0.0,0.099,0.901,0.5423,POSITIVE,3143.1,NEGATIVE,POSITIVE
178,ASIAN PAINTS LTD,2021-11-29,"asianpaint - intimation pursuant regulation thirty sebi listing obligations disclosures requirements regulations2015 asian paints focusto expand mfg capacity paint ankleshwar unit twenty-five lk kl thirteen lakh klto expand resins emulsions capacity eighty-five thousand thirty-two thousand tonnes ankleshwarto expand capacity nine hundred and sixty cr investment akleshwar next 2-3 yrs stocksinnews asian paints signs mou gujarat government invest rs nine hundred and sixty cr capacity expansionasianpaints asianpaints marketswithetnow shares asian paints trading higher nineteen per cent rs three thousand, one hundred and fifty bse asian paints limited - updates asian paints ltd inks mou expansion project outlay rs nine hundred and sixty croresasianpaintslimited ine021a01026 asianpaint expansion mou governmentofgujarat paints resins emulsions ankleshwar asian paints ltd said invest rs nine hundred and sixty crore expand manufacturing capacity facility situated ankleshwar gujaratasianpaints asian paints invest rs nine hundred and sixty cr expand capacity gujaratasianpaints asianpaints gujarat asian paints invest rs nine hundred and sixty crore expand manufacturing capacity gujarat asianpaints gujarat ankleshwar paintsindustry resinsandemulsions asian paints invest rs nine hundred and sixty cr expand gujarat unit",4,0.31870725750923157,0.01,0.099,0.89,0.9246,POSITIVE,3144.3,POSITIVE,POSITIVE
179,ASIAN PAINTS LTD,2021-11-30,stocks news go fashion irctc punjab national bank asian paints asian paints inks mou govt gujaratread more projectstoday news updates manufacturing ankleshwar investment paints,4,0.3016796112060547,0.0,0.0,1.0,0.0,NEUTRAL,3143.65,NEGATIVE,POSITIVE
180,ASIAN PAINTS LTD,2021-12-02,"mm top gainer sensex pack advancing two per cent followed hdfc titan power grid asian paints hcl tech buy asian paints target price rs three thousand, five hundred and seventy icici direct etmarkets dailyrecos stockpicks dailypicks",2,0.29218167066574097,0.0,0.049,0.951,0.2023,POSITIVE,3180.6,POSITIVE,NEGATIVE
181,ASIAN PAINTS LTD,2021-12-03,cnbctv18market macquarie feels mkt share gains allayed margin concerns benign competitive pressure benefit asian paints asianpaint - disclosures reg two hundred and ninety-two sebi sast regulations2011 mintpremium asian paints vs berger paints better read here,3,0.2891947031021118,0.049,0.324,0.626,0.8834,POSITIVE,3110.45,NEGATIVE,POSITIVE
182,ASIAN PAINTS LTD,2021-12-07,sharekhanresearch maintains buy asian paints pt rs3550 correction thirteen high provides good entry opportunity quality consumer play demand environment remains buoyant urban mkts price hike twenty-one mitigate input cost inflation stockstowatch asianpaint - compliances-reg thirty-nine three - details loss certificate duplicate certificate,4,0.3016796112060547,0.076,0.201,0.723,0.7351,POSITIVE,3030.35,NEGATIVE,POSITIVE
183,ASIAN PAINTS LTD,2021-12-08,asianpaint - announcement regulation thirty lodr-analyst investor meet - intimation asianpaint - response ingovern report relation asian paints limited post september quarter q2fy22 market leader decorative paints asian paints ltd took price hike 8-9 effective twelve november followed another 4-6 price hike effective five december according axis capital ltd,4,0.31870725750923157,0.035,0.115,0.85,0.6486,POSITIVE,3108.5,POSITIVE,POSITIVE
184,ASIAN PAINTS LTD,2021-12-09,cnbctv18market mm asian paints tata motors top nifty gainers stocks focus paint major refuted allegations made related-party transactions asian paints paladin paints chemicals brings us details,3,0.2891947031021118,0.0,0.158,0.842,0.5423,POSITIVE,3178.7,POSITIVE,POSITIVE
185,ASIAN PAINTS LTD,2021-12-10,"cnbctv18market asian paints indusind bank adani ports top nifty gainers opening trade marketatclosepaint stocks gain trade today asian paints top nifty gainerindusind ends two lower despite rbi approval lic raise stake coadani ent idfc first federal bank berger paints end top midcap gainers pune-based firm counts lupin lt asian paints reckitt cipla among clients raised pre-seed round one thousand, five hundred talks venture capitalists seed roundalnehaa reportscipla asianpaints asianpaint - announcement regulation thirty lodr-analyst investor meet - intimation marketswithbs asian paints sbi mm tcs bajaj finserv itc top sensex gainers tune daily market podcast market wrap latest updates stockmarkets markets marketswithbs asian paints sbi mm tcs bajaj finserv itc top sensex gainers tune daily market podcast market wrap latest updates stockmarkets markets",3,0.2891947031021118,0.035,0.132,0.832,0.8763,POSITIVE,3283.15,POSITIVE,POSITIVE
186,ASIAN PAINTS LTD,2021-12-13,tradespotlight heres recommends investors indian energy exchange siemens asian paints thermax market resumes trading todayfind outmarketswithmc stockmarket stocks stockstowatch asianpaint - closure trading window,5,0.3199969232082367,0.0,0.154,0.846,0.4588,POSITIVE,3279.85,NEGATIVE,POSITIVE
187,ASIAN PAINTS LTD,2021-12-14,asianpaint - disclosures reg three hundred and eleven three hundred and twelve sebi sast regulations2011 bsawards inflation hurts supplier buyer short-term problem country like india says kbs anand former md ceo asian paints discussion topic - new challenges indiainc face post-pandemic era asianpaint - announcement regulation thirty lodr-analyst investor meet - intimation,4,0.31870725750923157,0.101,0.066,0.833,-0.4588,NEGATIVE,3297.5,POSITIVE,POSITIVE
188,ASIAN PAINTS LTD,2021-12-15,asianpaint - announcement regulation thirty lodr-analyst investor meet - intimation,4,0.31870725750923157,0.0,0.0,1.0,0.0,NEUTRAL,3301.95,POSITIVE,POSITIVE
189,ASIAN PAINTS LTD,2021-12-21,asianpaint - disclosures reg two hundred and ninety-two sebi sast regulations2011 asianpaint - disclosures reg three hundred and eleven three hundred and twelve sebi sast regulations2011 asianpaint - disclosures reg three hundred and eleven three hundred and twelve sebi sast regulations2011,4,0.31870725750923157,0.0,0.0,1.0,0.0,NEUTRAL,3271.35,NEGATIVE,POSITIVE
190,ASIAN PAINTS LTD,2021-12-22,infosys asian paints tata steel among four stocks buy sensex nifty gain market texture volatilestockstobuy share sharemarket nifty nifty50 banknifty asianpaint - compliances-reg thirty-nine three - details loss certificate duplicate certificate,5,0.2487480491399765,0.059,0.28,0.662,0.8271,POSITIVE,3280.1,POSITIVE,POSITIVE
191,ASIAN PAINTS LTD,2021-12-23,opening bell markets open higher nifty seventeen thousand sensex two hundred and eighty pts gainers adani ports three ioc two ongc one losers upl divis lab asian paints dip marginally niftybank nifty stockmarketindia,3,0.2750897705554962,0.088,0.133,0.779,0.1832,POSITIVE,3267.9,NEGATIVE,POSITIVE
192,ASIAN PAINTS LTD,2021-12-27,asianpaint - compliances-reg thirty-nine three - details loss certificate duplicate certificate,4,0.31870725750923157,0.187,0.0,0.813,-0.3182,NEGATIVE,3272.4,POSITIVE,POSITIVE
193,ASIAN PAINTS LTD,2021-12-28,"sensex nifty days high asian paints eicher motors lt advance bqmarketsmarket blog marketswithbs headline indices extended gains afternoon trade near days highs supported select counters including asian paints tech mahindra larsen tourbo tata motorsread live updates herestockmarket markets sensex surges four hundred and seventy-seven points nifty settles seventeen thousand, two hundred and thirty-three sun pharma asian paints gain three eachsharemarket nifty sensex",4,0.3016796112060547,0.0,0.224,0.776,0.9349,POSITIVE,3368.2,POSITIVE,POSITIVE
194,ASIAN PAINTS LTD,2021-12-29,"buy asian paints target price rs three thousand, six hundred edelweiss etmarkets dailyrecos stockpicks dailypicks",3,0.29111963510513306,0.0,0.0,1.0,0.0,NEUTRAL,3367.45,NEGATIVE,POSITIVE
195,ASIAN PAINTS LTD,2021-12-30,domestic businesses high net worth individuals invested snapdeal ahead initial public offering buying chinese giant alibabahavells india asian paints invested snapdeal investment vehiclesby,3,0.24998661875724792,0.0,0.079,0.921,0.2263,POSITIVE,3365.7,NEGATIVE,POSITIVE
196,ASIAN PAINTS LTD,2022-01-03,asianpaint - board meeting intimation consideration approval financial results company quarter nine,4,0.31870725750923157,0.0,0.22,0.78,0.4767,POSITIVE,3422.4,POSITIVE,POSITIVE
197,ASIAN PAINTS LTD,2022-01-04,bajaj fin asian paints adani among consistent performersread at asianpaint - compliances-reg thirty-nine three - details loss certificate duplicate certificate,3,0.29111963510513306,0.108,0.0,0.892,-0.3182,NEGATIVE,3459.3,POSITIVE,POSITIVE
198,ASIAN PAINTS LTD,2022-01-07,technical picks bajaj auto rain industries balaji amines asian paints more asianpaint - compliances-reg thirty-nine three - details loss certificate duplicate certificate,5,0.3199969232082367,0.099,0.0,0.901,-0.3182,NEGATIVE,3576.3,POSITIVE,POSITIVE
199,ASIAN PAINTS LTD,2022-01-10,nifty could inching towards 18400-18600 new all-time high icici bank asian paints top betsnifty nifty50 stockmarketindia sharemarket sharekhanresearch consumer goods q3 preview moderate quarter lower sales vol due slowing rural demand opm remain lower y-o-y due inflated input prices preferred pick hul asian paints marico tata consumer radico khaitan globus spirits past seven decades asian paints built indias largest paint dealer network seven hundred thirty-five thousand dealers 2013-14 fy14sharleendsouza reports asianpaints,1,0.21789683401584625,0.077,0.059,0.864,-0.1027,NEGATIVE,3553.5,NEGATIVE,NEGATIVE
200,ASIAN PAINTS LTD,2022-01-14,hdfc hcl tech asian paints wipro upl among major losers nifty gainers cipla ioc lt titan company divis labsstockmarket nifty sensex share market live sensex falls 61k volatile trade asian paints axis bank nestle india top losers,5,0.25781577825546265,0.148,0.203,0.649,0.1494,POSITIVE,3364.4,NEGATIVE,POSITIVE
201,ASIAN PAINTS LTD,2022-01-17,big week earningsmon 17th ultratech cementtue 18th bajaj finance ltwed 19th bajaj auto ceatthur 20th asian paints hul persistentfri 21st reliance hdfc life jsw steel sat 22nd icici bank,3,0.29111963510513306,0.0,0.0,1.0,0.0,NEUTRAL,3378.65,POSITIVE,POSITIVE
202,ASIAN PAINTS LTD,2022-01-18,addverb developed highly automated warehouses brands flipkart hul asian paints coca-cola pepsi itc maricopeerzadaabrar reportsreliance addverbtechnologies exclusive set buy twenty-four percent shalimar paints move invest rs two hundred and seventy crore pits construction solutions company paints biggies asian paints kansai nerolac berger exclusive set buy twenty-four percent shalimar paints move invest rs two hundred and seventy crore pits construction solutions company paints biggies asian paints kansai nerolac berger,4,0.31870725750923157,0.0,0.091,0.909,0.5267,POSITIVE,3373.7,NEGATIVE,POSITIVE
203,ASIAN PAINTS LTD,2022-01-19,"asianpaint - shareholding period ended decemberasianpaint - disclosures reg one hundred and six sebi sast regulations2011 asianpaint - disclosures reg one hundred and six sebi sast regulations2011 3qwithcnbctv18 asian paints hul report q3 results tomorrow gets us key expectations marketatclose bajaj finance slips six highs close two lowerbajaj auto ends higher hul asian paints slip ahead earningsongc top nifty gainer crude extending gains stock four marketatclose shree cement infosys asian paints hul adani ports top nifty loserscement stocks slip 2nd straight day shree three ultratech falls 2it stocks slip following crack seen global peers infosys three earningswithetnow asian paints q3 net profit may fall eleven yoy rs one thousand, one hundred and thirty-one cr ebitda margin expected fall due inflationary pressureasianpaints asianpaints asianpaintsq3 q3fy22 stockmarket asian paints tata elxsi stocks moved janaury nineteen stockmarket asian paints tata elxsi stocks moved january nineteen asianpaint - disclosures reg one hundred and six sebi sast regulations2011 asianpaint - disclosures reg one hundred and six sebi sast regulations2011",4,0.31870725750923157,0.021,0.092,0.887,0.8591,POSITIVE,3280.4,NEGATIVE,POSITIVE
