,CompanyName,Date,Title,level,overall_twitter_score,negative_score,positive_score,neutral_score,compound_score,final_tag,Close,final_tag_stock5,final_tag_bert
86,ASIAN PAINTS LTD,2021-05-14,"themarket catch amit syngle asian paints one thousand et nowearningswithetnow 4qwithcnbctv18 goldman sachs continues sell call asian paints 4qwithcnbctv18 hsbc buy call asian paints co gives exceptional performance fy21 despite disruption outlook fy22 remains strong well 4qwithcnbctv18 jefferies maintains hold call asian paints cuts target rs two thousand, four hundred rs 2500sh 4qwithcnbctv18 cs maintains outperform call asian paints expects resilient volume growth going forward govt extends gap second covishield jab 12-16 weeks lockdowns working every state asian paints came fiscal two thousand and twenty-one nearly unscathed pandemic read latest business news mint e-paper maintain reduce asian paints - exceeds expectations - hdfc securitiesasianpaints hdfcsecurities sharekhanresearch retains buy asian paints tp rs3000 q4 power forty-eight vol growth mgmt maintained medium term outlook double digit revenue growth raw material inflation mitigated price hike efficiencies stockstowatch marketopening market opens mildly higher asian paints among top gainers nifty company reported volume growth forty-eight q4 cnbctv18market upl asian paints top nifty gainers opening trade marketswithmc opening bell indices open flat amid positive global cues upl asian paints focusstockstowatch stockmarket live talking point localised lockdowns impacted asian paints conversation md ceo amit syngle bqlive asian paints share rose ten early trade markets defy positive cues inflation iip data metal underperforms tata twins hindalco coal india top bears asian paints surge 10stockmarket metals inflation sensex trades green asian paints zooms itc dr reddys contribute sensex gains oncnbctv18 grew twenty jan feb march aided low base april normal far may seen disruption amit syngle asian paints tells uslast year tier three four cities well time theyre affected more adds earningswithetnow asian paints managed deliver forty-eight volume growth lockdowns material inflation affecting company md ceo amit syngle shares insightsasianpaints covidsecondwave asian paints shares surge eleven stellar q4 results buy sell hold themarket delivering forty-eight volume growth q4 extent localized lockdown dampen asian paints sales april may heres amit syngle md ceo asian paints viewasianpaints lockdown sales themarket delivering forty-eight volume growth q4 extent localized lockdown dampen asian paints sales april may heres amit syngle md ceo asian paints viewasianpaints lockdown sales themarket delivering forty-eight volume growth q4 extent localized lockdown dampen asian paints sales april may heres amit syngle md ceo asian paints viewasianpaints lockdown sales themarket margins dropped previous quarter commodity inflation pressures got asian paints already heres amit syngle md ceo asian paints sharing companys future outlookasianpaints asianpaints lockdown sales themarket margins dropped previous quarter commodity inflation pressures got asian paints already heres amit syngle md ceo asian paints sharing companys future outlookasianpaints asianpaints lockdown sales themarket margins dropped previous quarter commodity inflation pressures got asian paints already heres amit syngle md ceo asian paints sharing companys future outlookasianpaints asianpaints lockdown sales asian paints virtually untouched pandemicimharshaj via themarket delivering forty-eight volume growth q4 extent localized lockdown dampen asian paints sales april may heres amit syngle md ceo asian paints viewasianpaints lockdown sales neutral asian paints target price rs two thousand, six hundred and twenty motilal oswal etmarkets dailyrecos stockpicks dailypicks asian paints shares surge march quarter profit rises eighty asian paints shares rally decade q4 results bqstocks read asian paints virtually untouched pandemicimharshaj via closing bell indices end flat nifty settles 14700-mark gainers asian paints eight upl seven losers coal india tata steel tata motors -4stockmarket stocks nifty marketatclose asian paints upl surge jspl piramal fall q4 earningscoal india tata motors hindalco tata steel top nifty losers marketthisweek psu bank psu index gain three weekupl asian paints coal india ioc power grid top nifty gainersjsw steel grasim hindalco adani ports axis bank top nifty losers marketswithbs sensex ends choppy day forty-two pts up asian paints jumps eight tata steel four increased prices may due rise raw material cost amit syngle md asian paints paintsindustry asianpaintsprices asianpaints amitsyngle covid19impactonpaintsindustry asian paints eight hundred and fifty-one pc rs 277360asianpaints bse itc indusindbank ntpc asian paints managed best day nearly year rising eighty-five per cent following bubbly commentary company management",5,0.3199969232082367,0.035,0.148,0.817,0.997,POSITIVE,2774.5,POSITIVE,POSITIVE
87,ASIAN PAINTS LTD,2021-05-18,"clutterbreakers macquarie raised target asian paints rs three thousand, two hundred rs two thousand, nine hundred tells us top consumer stocks hindustan unilever nestle asian paints titan avenue supermarts among others missing monthly shopping lists mutual funds two thousand and twenty-one q4fy21withhdfcsecurities catch q4 earnings highlights asian paints ltdclick read report pg three click watch hindi earnings stocks",3,0.2891947031021118,0.037,0.03,0.933,-0.1027,NEGATIVE,2821.8,POSITIVE,POSITIVE
88,ASIAN PAINTS LTD,2021-05-25,"indian shares gain strong earnings asian paints infosys shine sensex surged two hundred and fifty points opening trade tuesday tracking gains index heavyweights infosys asian paints hdfc asian paints berger paints hit new highs gain fifteen monthsensex marketswithbs marketsnewsmarketupdate nifty closing bell markets end flat note volatile session nifty holds fifteen thousand, two hundred losers hdfc bank -172 axis bank -102 gainers jsw steel three hundred and ninety-five asian paints 3stockmarket niftybank nifty hdfcbank marketatclose metal stocks rebound today trade jsw steel rises 3titan moves three higher govt makes hallmark compulsorypaints autos gain unlock trade asian paints pvr four",5,0.2487480491399765,0.029,0.221,0.75,0.9674,POSITIVE,2914.4,POSITIVE,POSITIVE
89,ASIAN PAINTS LTD,2021-05-26,creditsuisse brokerageadds weigthage asian paints ultratech cementstay underweight cut hcl tech switch weights tcscut staples medium-weight cut nestle add smaller weight maricocut nbfcs further bajaj fin weight zero underweight insurance bswebexclusive top trading ideas ajit mishra buy asian paints idfc first banksensex nifty marketswithbs marketstockstobuystockstowatch titan top gainer sensex followed sun pharma mm lt bajaj finserv hul asian paints blmarketwatch,3,0.2891947031021118,0.064,0.096,0.84,0.2732,POSITIVE,2941.6,POSITIVE,POSITIVE
90,ASIAN PAINTS LTD,2021-05-28,berger tracked asian paints closely march quarter lost fy21imharshaj via,3,0.29111963510513306,0.204,0.0,0.796,-0.3182,NEGATIVE,2940.7,NEGATIVE,POSITIVE
91,ASIAN PAINTS LTD,2021-06-01,d-street chatter gets insights dealing rooms tells us stocks like adani ports adani ent sbi shriram transport asian paints buzzing trade,3,0.24998661875724792,0.0,0.111,0.889,0.3612,POSITIVE,2931.0,NEGATIVE,POSITIVE
92,ASIAN PAINTS LTD,2021-06-02,bswebexclusive shares asian paints berger paints india hit respective record highs bse may rising crude oil prices dent sentimentavdhutbagkarstocksinnewsstockstowatch marketsmarketswithbs sensex trading fuel itc top loser sensex pack shedding nearly three followed tech mahindra axis bank asian paints tcs hcl tech hdfc kotak bank stockmarketindia,3,0.29111963510513306,0.132,0.126,0.742,-0.3182,NEGATIVE,2903.7,NEGATIVE,POSITIVE
93,ASIAN PAINTS LTD,2021-06-03,asian paints management quite confident demand revival post easing restrictions told very strong bounceback demand q2 q3 q4economy coming backmarkets opening slowlyfy22 good year will take price hikes pass rm cost,4,0.31870725750923157,0.087,0.296,0.617,0.8571,POSITIVE,2935.35,POSITIVE,POSITIVE
94,ASIAN PAINTS LTD,2021-06-07,asian paints heart is season four culminates another success series,4,0.31870725750923157,0.0,0.497,0.503,0.836,POSITIVE,2933.1,NEGATIVE,POSITIVE
95,ASIAN PAINTS LTD,2021-06-08,sharekhanresearch q4fy21 consumer goods cg review q4 boosted buoyancy demand low base q4fy20 medium term outlook remains steady cg cos preferred picks hul asian paints gcpl marico itc stockstowatch sharekhanresearch maintains buy asian paints tp rs3255 phase-wise unlocking various states lead gradual recovery painting activities coming months home improvement segment recover h2fy2022 stockstowatch,4,0.3016796112060547,0.062,0.095,0.843,0.4404,POSITIVE,2926.25,NEGATIVE,POSITIVE
96,ASIAN PAINTS LTD,2021-06-10,asian paints limited - analystsinstitutional investor meetcon call updates,4,0.31870725750923157,0.192,0.0,0.808,-0.2263,NEGATIVE,2950.6,POSITIVE,POSITIVE
97,ASIAN PAINTS LTD,2021-06-11,cnbctv18market macquarie maintains outperform call asian paints target rs 3200sh,3,0.2891947031021118,0.0,0.0,1.0,0.0,NEUTRAL,2956.25,POSITIVE,POSITIVE
98,ASIAN PAINTS LTD,2021-06-15,"market call saurabh mukherjea founder believes bull market impacted due rise interest rates conversation says prefers stocks like asian paints vs cyclical stocks twenty-two d-street chatter gets insights dealing rooms tells us stocks like zee ent care ratings asian paints dial buzzing trade closing bell markets end higher led financial stocks nifty settles fifteen thousand, eight hundred and fifty gainers asian paints two hundred and fifty-five axis bank one hundred and seventy-seven eicher one hundred and fifty losers divis lab -13 coal india -1 bajaj finserv -085nifty axisbank hdfcbank marketatclose icici hdfc bank asian paints lift tcs bajaj fin dragicici bank contributes one hundred and thirty-one points nifty bank gain two hundred and ninety-seven pointsinfo edge adani ent gmr infra amongst top midcap contributors marketatclose asian paints top nifty gainer reports hike product pricesjubilant food slips whirlpool gains jan-march earnings",2,0.29218167066574097,0.021,0.179,0.8,0.9694,POSITIVE,3042.2,POSITIVE,NEGATIVE
99,ASIAN PAINTS LTD,2021-06-16,"fo cues fiis add one thousand, six hundred and thirteen short contracts index futures asian paints gmr infra see fresh longs wraps derivative cues trade morning",5,0.23247811198234558,0.0,0.084,0.916,0.3182,POSITIVE,3018.7,NEGATIVE,POSITIVE
100,ASIAN PAINTS LTD,2021-06-17,asian paints limited - loss share certificates,4,0.31870725750923157,0.404,0.212,0.385,-0.25,NEGATIVE,3060.3,POSITIVE,POSITIVE
101,ASIAN PAINTS LTD,2021-06-21,"nifty may hit sixteen thousand, one hundred crosses fifteen thousand, seven hundred and fifty bank nifty remains uptrend infosys asian paints focusnifty bankniftyfuture stocks stockmarket infosys bizongo appoints asian paints veteran manish choksi advisory boardread full details appointment",1,0.21789683401584625,0.0,0.13,0.87,0.6597,POSITIVE,3068.55,POSITIVE,NEGATIVE
102,ASIAN PAINTS LTD,2021-06-22,"asian paints veteran manish choksi joins bizongo advisory boardasianpaints manishchoksi bizongo advisoryboard asian paints veteran manish choksi joins bizongo advisory boardasianpaints closing bell markets pare gains nifty settles fifteen thousand, seven hundred and sixty rupee hits seven hundred and forty-four lowest level since april twenty-eight losers asian paints -196 bajaj fin -160 nestle hul -1 gainers maruti five upl shree cement 38marutisuzuki stockmarket",4,0.31870725750923157,0.086,0.073,0.842,-0.2263,NEGATIVE,3010.8,NEGATIVE,POSITIVE
103,ASIAN PAINTS LTD,2021-06-23,asian paints board approves appointment deepak satwalekar chairman board current chairman ashwin dani shall continue board ofdirectors company non executivepromoter director,4,0.31870725750923157,0.0,0.119,0.881,0.4019,POSITIVE,2987.35,NEGATIVE,POSITIVE
104,ASIAN PAINTS LTD,2021-06-25,marketthisweek maruti tata steel infosys bajaj finserv top nifty gainers reliance kotak bank asian paints hul nestle top nifty losers week,2,0.29218167066574097,0.12,0.317,0.563,0.5574,POSITIVE,3003.9,POSITIVE,NEGATIVE
105,ASIAN PAINTS LTD,2021-06-28,sensex nifty today asian paints top gainer sensex pack rising one percent followed dr reddys ntpc axis bank sun pharma kotak bank icici bank reliance industries asian paints smartcare damp proof damp proof ultra give ultimate waterproof protection terraces exteriors year round find here smartcare dampproofrange ultimateterracewaterproofing partnered -,4,0.3016796112060547,0.0,0.087,0.913,0.5423,POSITIVE,2982.95,NEGATIVE,POSITIVE
106,ASIAN PAINTS LTD,2021-06-29,asianpaint - asian paints employees stock ownership trust - trust deed,4,0.31870725750923157,0.0,0.423,0.577,0.765,POSITIVE,3001.5,POSITIVE,POSITIVE
107,ASIAN PAINTS LTD,2021-07-01,"opening bell markets open flat nifty fifteen thousand, seven hundred mm eighty-two airtel seventy-nine asian paints seventy-eight losers infosys -084 britannia -039stockmarket nifty uttar pradesh asian paints berger paints close terms market share",3,0.2750897705554962,0.085,0.19,0.725,0.4939,POSITIVE,3021.6,POSITIVE,POSITIVE
108,ASIAN PAINTS LTD,2021-07-02,uttar pradesh asian paints berger paints close terms market share,5,0.2740285396575928,0.0,0.196,0.804,0.296,POSITIVE,3005.0,NEGATIVE,POSITIVE
109,ASIAN PAINTS LTD,2021-07-06,institutional voting top management pay asian paints balkrishna industries focusread,5,0.2487480491399765,0.125,0.161,0.714,0.1027,POSITIVE,3002.5,NEGATIVE,POSITIVE
110,ASIAN PAINTS LTD,2021-07-07,"opening bell markets open red nifty fifteen thousand, eight hundred losers tata motors -26 ongc indusind bank -1 gainers asian paints eighty-five adani ports fifty hdfc top gainer sensex pack rising nearly two per cent followed asian paints tata steel powergrid bajaj finserv maruti hdfc bank blmarketwatch marketatclose paints stocks rise minor fall seen crude asian paints one",3,0.2750897705554962,0.108,0.069,0.823,-0.5574,NEGATIVE,3040.1,POSITIVE,POSITIVE
111,ASIAN PAINTS LTD,2021-07-08,sharekhanresearch q1fy22 consumer goods preview low base agile supply chain resilient demand would help clock double digit revenue growth most rm inflation high ad-spends lower opm pref picks asian paints hul gcpl marico tata consumer products,4,0.3016796112060547,0.138,0.126,0.736,0.128,POSITIVE,3028.3,NEGATIVE,POSITIVE
112,ASIAN PAINTS LTD,2021-07-13,mindtree asian paints increasing number esop schemes facing opposition institutional investors sterling wilson solar vst industries intellect design arena khadim india jubilant ingrevia mindtree - even blue-chip companies put notice asian paints,2,0.29218167066574097,0.0,0.223,0.777,0.8074,POSITIVE,2993.85,NEGATIVE,NEGATIVE
113,ASIAN PAINTS LTD,2021-07-14,mindtree asian paints increasing number esop schemes facing opposition institutional investors,2,0.29218167066574097,0.0,0.115,0.885,0.0772,POSITIVE,3001.95,POSITIVE,NEGATIVE
114,ASIAN PAINTS LTD,2021-07-16,"sensex rises two hundred and fifty-five points record high nifty hits fifteen thousand, nine hundred and twenty-four itc asian paints tata steel top gainers",4,0.3016796112060547,0.0,0.17,0.83,0.5423,POSITIVE,2989.3,NEGATIVE,POSITIVE
115,ASIAN PAINTS LTD,2021-07-19,earningswithetnow asian paints set report q1fy22 numbers check et poll expecting asianpaints,4,0.27463361620903015,0.0,0.0,1.0,0.0,NEUTRAL,2981.95,NEGATIVE,POSITIVE
116,ASIAN PAINTS LTD,2021-07-20,"hcl tech clean science gr infra dial airtel vodafone idea asian paints rinfra stocks focus hcltech bhartiairtel vodafoneidea justdial stocks sgxnifty stockmarkets hcl tech bajaj finance clean science asian paints stocks watch todays trademarketswithbs markets sensex nifty investment stockstowatchstockmarkets nifty seen opening lower hcl tech asian paints bajaj finance focus important results today bajaj finance asian paints reliance industrial infraresults bajajfinance asianpaints reliamceindustrialinfra stockstowatch stocks ultratech cement powergrid asian paints among major gainers stockmarket stockmarkets cnbctv18market asian paints higher ahead earnings asian paints stock nears record high ahead q1 resultsasianpaints 1qwithcnbctv18 asian paints q1 net profit comes rs five hundred and seventy-four cr vs cnbc-tv18s poll rs seven hundred and twenty-one cr 1qwithcnbctv18 asian paints fared yoy asian paints q1 net profit in-line estimates q1withbq asian paints ltd q1fy22 consolidated net profit drops qoq rs fifty-six thousand, eight hundred and fifty croresasianpaints q1fy22 resultupdate asian paints q1 results net profit soars one hundred and sixty-one rs five hundred and seventy-four cr domestic decorative business doubled volume lower base last year says asian paints amit syngle q1withbq asian paints market cap three lk cr 1qwithcnbctv18 asian paints moves sharply higher earnings cnbctv18market asian paints surges 52-week high earningswithmc asian paints said june quarter net profit doubled rs five thousand, seven hundred and forty-three crore rs two thousand, one hundred and ninety-six crore yoy asianpaints q1results asianpaints asian paints quarterly profit met estimates even margin contracted higher raw material costs q1withbqsharleendsouza reports marketswithbs asian paints rallies seven hits record high q1 profit beats estimateq1fy22 closing bell markets end lower selling pressure seen bank metal stocks nifty drags fifteen thousand, six hundred and fifty sensex drops three hundred and fifty pts losers hindalco -4 indusind bank tata steel -3 gainers asian paints six ultratech 2nifty niftybank stocks marketatclose asian paints moves recovers losses close six higher q1 earnings marketatclose asian paints recovers losses close six higher q1 earnings asian paints q1 profit jumps twofold rs fifty-seven thousand, four hundred and thirty cr asian paints consolidated q1 pat rises one hundred and sixty yoy rs56850cr stock hits fresh record highasianpaints asian paints q1 profit jumps twofold rs fifty-seven thousand, four hundred and thirty crore expressbiz quarterly results alert asian paints reports one hundred and sixty-one jump q1fy22 profit amid strong volume growth share price surges near 7asianpaints asianpaintsq1 asian paints stock soared five per cent biggest one-day move months optimistic commentary given management asian paints market cap tops rs three trillion stock gains six closefirm becomes indias 12th valuable company june quarter results beat expectationsasianpaints asian paints net profit rises one hundred and sixty rs five hundred and sixty-eight cr april-june asian paints profit jumps two-fold rs fifty-seven thousand, four hundred and thirty crore q1 fy22 asianpaints asianpaintsprofit paintsindustry covid19impactonpaintsindustry amitsyngle",5,0.25781577825546265,0.037,0.143,0.819,0.9941,POSITIVE,3159.05,POSITIVE,POSITIVE
117,ASIAN PAINTS LTD,2021-07-22,"1qwithcnctv18 ms downgrades asian paints equal-weight uncertain direction margin 1qwithcnctv18 gs sell call asian paints belives gross margin contraction raises questions pricing power 1qwithcnctv18 ubs maintains buy call asian paints target rs 3550sh 1qwithcnctv18 nomura neutral stance asian paints believes margin remain compressed near-term pricing trails commodity inflation 1qwithcnctv18 macquarie outperform rating asian paints q1 sales performance re-emphasised resilient nature decorative demand 1qwithcnctv18 clsa maintains outperform call asian paints co optimistic demand fy22 better monsoon long diwali pent-up demand 1qwithcnctv18 clsa maintains outperform call asian paints co optimistic demand fy22 better monsoon long diwali pent-up demand cnbctv18market hsbc maintains buy call asian paints target rs three thousand, five hundred sharekhanresearch retains buy asian paints revised tp rs3550 q1fy22 performance boosted resilience demand mkt share gains paints product launches scale home improvement biz key growth drivers medium term stockstowatch opening bell gap-up t sensex nifty nifty fifteen thousand, seven hundred sensex three hundred and fifty pts gainers hindalco wipro ongc two losers asian paints tcs hcl tech stocks marginally downstocks nifty oncnbctv18 q1 volume growth one hundred and five 2-year cagr fourteen still room pent-up demand q2 asian paints amit syngle tells uswill maintain 2-year cagr growth rate mid-teens adds stockmarket thursdays top brokerage calls jubilant foodworks asian paints bajaj finance more asian paints gone town superlative q1 show though painted bright picture pricey valuation hot handle sachin pal writes mcproasianpaints earnings stockstowatch asian paints bets growth margins investors loving itimharshaj via add asian paints target price rs three thousand, four hundred icici securities etmarkets dailyrecos stockpicks dailypicks heres analysts made asian paints q1 performance q1withbq bqstocks closing bell markets end higher one positive cues global markets nifty regains fifteen thousand, eight hundred sensex surges six hundred pts gainers tech mahindra six jsw steel fifty-six bajaj finance four losers hul asian paints -2 bajaj auto -15stocks closing bell markets end one higher positive cues global markets nifty regains fifteen thousand, eight hundred sensex surges six hundred pts gainers tech mahindra six jsw steel fifty-six bajaj finance four losers hul asian paints -2 bajaj auto -15stocks marketatclose sensex nifty close day high nifty bank ends highs infosys icici reliance lift nifty hul asian paints bajaj auto dragnifty closes one hundred and ninety-two points higher fifteen thousand, eight hundred and twenty-four sensex six hundred and forty-nine points higher fifty-two thousand, eight hundred and forty-seven",5,0.42043355107307434,0.057,0.164,0.778,0.9933,POSITIVE,3106.75,NEGATIVE,POSITIVE
118,ASIAN PAINTS LTD,2021-07-23,"add asian paints target price rs three thousand, four hundred icici securities etmarkets dailyrecos stockpicks dailypicks marketsthisweek bajaj finserv wipro asian paints bpcl nestle top nifty gainers",4,0.31870725750923157,0.0,0.218,0.782,0.6908,POSITIVE,3083.75,NEGATIVE,POSITIVE
119,ASIAN PAINTS LTD,2021-08-03,"opening bell markets open higher sensex 53k nifty fifteen thousand, nine hundred gainers asian paints adani ports two britannia fifteen losers grasim -15 jsw steel shree cements -1 cnbctv18market wipro hdfc asian paints britannia top nifty gainers asian paints tech mahindra hdfc titan among major winners dr reddy ntpc lt hcl tech major losers opening session stockmarketindia stockmarketnews stock market updates sensex two hundred points nifty fifteen thousand, nine hundred asian paints hdfc top gainers",3,0.2750897705554962,0.08,0.169,0.751,0.7184,POSITIVE,3027.0,NEGATIVE,POSITIVE
120,ASIAN PAINTS LTD,2021-08-04,asianpaint - compliances-reg thirty-nine three - details loss certificate duplicate certificate,4,0.31870725750923157,0.187,0.0,0.813,-0.3182,NEGATIVE,3018.6,NEGATIVE,POSITIVE
121,ASIAN PAINTS LTD,2021-08-06,asianpaint - disclosures reg three hundred and eleven three hundred and twelve sebi sast regulations2011,4,0.31870725750923157,0.0,0.0,1.0,0.0,NEUTRAL,2966.45,NEGATIVE,POSITIVE
122,ASIAN PAINTS LTD,2021-08-09,asianpaint - announcement regulation thirty lodr-analyst investor meet - intimation,4,0.31870725750923157,0.0,0.0,1.0,0.0,NEUTRAL,2992.55,POSITIVE,POSITIVE
123,ASIAN PAINTS LTD,2021-08-12,asianpaint - compliances-reg thirty-nine three - details loss certificate duplicate certificate miko raises twenty-eight million series b round led iifl amc mankind pharma family office aroa ventures manish choksi asian paints clutch global investorsmikorobot,4,0.31870725750923157,0.065,0.0,0.935,-0.3182,NEGATIVE,2975.5,NEGATIVE,POSITIVE
124,ASIAN PAINTS LTD,2021-08-13,"categories likely pick festive period amit syngle asian paints new campaign impact covid19 ascis new brand identity outlook coming monthswatch sat eight hundred and thirty sun one thousand, one hundred and thirty amarn categories likely pick festive periodamit syngle asian paints new campaign impact covid19 subkam ascis new brand identity outlook coming monthswatch sat eight hundred and thirty sun one thousand, one hundred and thirty categories likely pick festive periodamit syngle asian paints new campaign impact covid19 ascis new brand identity outlook coming monthswatch sat eight hundred and thirty sun one thousand, one hundred and thirty",3,0.2891947031021118,0.0,0.088,0.912,0.8402,POSITIVE,2988.7,POSITIVE,POSITIVE
125,ASIAN PAINTS LTD,2021-08-17,asian paints raises product prices pass higher input costsblitzkreigm,4,0.31870725750923157,0.0,0.0,1.0,0.0,NEUTRAL,3015.3,POSITIVE,POSITIVE
126,ASIAN PAINTS LTD,2021-08-18,"cnbctv18market hdfc bank hcl tech asian paints top nifty gainers opening bell markets open record high led hdfc bank nifty sixteen thousand, six hundred and fifty sensex climbs two hundred pts gainers hdfcbank three hdfc asian paints titan one losers infosys icici bank -1niftybank nifty stocks stockmarket asianpaint - compliances-reg thirty-nine three - details loss certificate duplicate certificate",3,0.2891947031021118,0.084,0.146,0.769,0.4939,POSITIVE,3001.55,NEGATIVE,POSITIVE
